{
  "CdiInputSpecification": "example-value",
  "Destinations": "example-value",
  "EncoderSettings": "example-value",
  "InputAttachments": "example-value",
  "InputSpecification": "example-value",
  "LogLevel": "example-value",
  "Maintenance": "example-value",
  "Name": "example-resource",
  "RoleArn": "arn:aws:service:us-east-1:123456789012:resource/example"
}